{
  "receipt_schema_version": "myresearcher.encoder-m2-s1-owner-authorization-receipt.v1",
  "authorization_granted": false,
  "owner_decision_id": "REQUIRED_FUTURE_OWNER_DECISION_ID",
  "expires_at_utc": "REQUIRED_FUTURE_UTC_EXPIRY",
  "frozen_contract_commit": "0d2f64cf0ce26953e83b17d043da4441f4930dc0",
  "contract_sha256": "d442b3d038e7e1a680a37f23f12c3556647114880fe2e8f3450488dd387de418",
  "stage_id": "M2-S1-FROZEN-SHARED-SEVEN-HEAD-CONTROL",
  "model": {
    "model_id": "hfl/rbt3",
    "revision": "0aa0527ff4170f29e1dfd3eb6ef60dc67e1bf75c",
    "license": "Apache-2.0",
    "model_weight_sha256": "3e04f7477f55dffce2a2fbc4d0ba35068415162a9e92e3d5cc74a49781ba4eb0",
    "tokenizer_json_sha256": "53ff61207898738bbdc000f38abebef01041c8d23b6270c11855fc692d0a3ad6",
    "vocab_txt_sha256": "45bbac6b341c319adc98a532532882e91a9cefc0329aa57bac9ae761c27b291c"
  },
  "cache_policy": {
    "local_files_only": true,
    "no_download": true
  },
  "execution": {
    "seeds": [35, 71, 107],
    "train_rows": 1822,
    "dev_rows": 448,
    "train_role": "TRAIN_ONLY_FIT",
    "dev_role": "EARLY_STOPPING_AND_DIAGNOSTIC_ONLY",
    "device_policy": "MPS_FIRST_CPU_FALLBACK",
    "per_run_wall_time_minutes": 120,
    "total_new_local_disk_gib": 10,
    "prohibitions": {
      "test": false,
      "anchor": false,
      "gold": false,
      "ood": false,
      "llm": false,
      "cloud_or_external_api": false,
      "production": false,
      "model_download": false,
      "dependency_install": false,
      "full_unfreeze": false,
      "s2_or_s3": false
    }
  },
  "receipt_content_address": "NOT_A_RECEIPT_TEMPLATE_REQUIRES_CANONICAL_SHA256"
}
